Sr.no.,Review_body,anger,anticipation,disgust,fear,joy,sadness,surprise,trust,negative,positive,sent.val1,category_senti1,Date,Weekday,Month and Year,May-17,Jun-17,Jul-17,Aug-17,Sep-17,Oct-17,Nov-17,Dec-17,Jan-18,Feb-18,Mar-18,Apr-18,May-18,Jun-18,Jul-18,Aug-18,Sep-18,Oct-18,Nov-18
412, recently migrated £ per month deal old phone old functioning effectively sent new phone tablet february transferred sim card old mobile new one couple days later woke one morning find calls internet emails barred called s call centre based phillipines told cancelled account via bank explained person spoke pigeon english asked bank cancel old direct debit end paying monthly amounts money told advisor go ahead set new monthly direct debit surprised done also said put g left g new mobile reason upgraded mobile new contract well phone unblocked days receiving text messages say paid bill blocked etc etc incredulous say least called phillipines call centre spoke another person time seemed know apologised perfusely series extremely upsetting time consuming events promised refund £ back onto account paying old contract taken account put hold whilst preseumably said start paying new phone tablet april also stated nothing explained sorry etc etc explained work hospital one day tried call manager nurse explain important information patient phone barred go downstairs hospital use phone alternative department stressed last month demanding fast paced job got home continuously call call centres kept rerouting phillipines talk advisers lost jist problems translation resolve problem now use mobile phone fine good call signals even g coverage much worse checked bank account see refund £ gone account told bank advisor nothing mobile refunded last months kept checking back long way account sure feel tile review service justice word looking diabolical now pocket financially stopped using old phone straight receiving new one february obviously charged seems hope refund hope owner comes across review needs brought highest level therefore review warrant minus xero stars thing unacceptable think normal well adjusted person reading totally agree comments ,3,12,2,5,6,6,7,17,13,21,6.05,Positive,08-Apr-18,Sunday,Apr-18,,,,,,,,,,,,,,,,,,,
413, totally unjust bill mobile charging £ phantom mobile data usage member team agreed waive fee rescinded manager openly admitted thought fee unreasonable opinion rescind despite offering £ back mb data £ thanks network years care less treating loyal customer like disappointing unnecessary ,2,3,0,2,1,1,1,5,5,4,0.75,Positive,07-Apr-18,Saturday,Apr-18,,,,,,,,,,,,,,,,,,,
414, poor signal quality truely truely bad customer service rang february request conference calling advertised available told don t provide service  d screen grabbed heated debate denial promised call back nothing happened suprise suprise favour avoid ,1,0,1,2,0,1,0,2,3,4,-0.4,Negative,05-Apr-18,Thursday,Apr-18,,,,,,,,,,,,,,,,,,,
415, literally worst service ever ever consistently horrendous signal quality write bar friend full signal  t even cancel contract website call foreign call centre charges per minute way barely speak english basically refuse say literally idea  big  company still around ,0,0,0,0,1,1,0,1,3,2,-0.9,Negative,05-Apr-18,Thursday,Apr-18,,,,,,,,,,,,,,,,,,,
416, fooled cheap monthly plans sure offer shed load data good luck using disgraceful mobile coverage central london g time even make call minute received text saying wife called times phone ring voicemail system s involved promise worth aggro delhi call centre either ,1,4,1,0,3,0,2,3,3,6,1.9,Positive,05-Apr-18,Thursday,Apr-18,,,,,,,,,,,,,,,,,,,
417, ok want leave real test company beginsgetting pac code nightmare spoke someone possibly far east whose english accented undecipherable talking quickly demanding tell wanted pac code refused tell said right must give started talking honestly sure time catch couple words constant repetition think wonderful deal suddenly appeared nowhere unlimited minutes data rarely use minutes need dual sim phone one data sim best data deal ever another company need data understand kept shout stop moment wonderful silence told bullying harrassing respecting wishes right ignore sullen said text two days later spoke someone else told already harrassed prepared answer questions gave pac code phone asked previous person given hesitating said idea felt wanted say company policy send initially hope customer forgets perhaps cynicismobviously big bonus stopping people getting pac codes either bullied endappauling behaviour monitor calls say must approve bullying shall return virign shape form ,3,6,0,1,5,3,8,10,9,13,1.25,Positive,04-Apr-18,Wednesday,Apr-18,,,,,,,,,,,,,,,,,,,
418, worst experience ever incompetent staff poor advice call centre philippines resources provide correct information want waste time end nothing hours phone sorting investigating choose media given address write media po box matrix court swansea sa bb ,2,2,1,1,1,1,0,4,2,4,-0.05,Negative,04-Apr-18,Wednesday,Apr-18,,,,,,,,,,,,,,,,,,,
419, one worst network customer service ever used never even give free even though use ee call quality poor keeps dropping nit good ee customer service nightmare ,0,2,0,1,1,0,1,2,1,3,-0.1,Negative,04-Apr-18,Wednesday,Apr-18,,,,,,,,,,,,,,,,,,,
420, mobile changed package error without consent trying months reverse error meantime package totally unsuited needs incurring charges time call receive apology promise package put back find receive next bill changes made todaytoday advised original package exist closest half amount data previously option advice anyone reading touch mobile time mobile worth recommending ship sailed number years ago soon contracts end son daughter moving helpfulprofessional company note also one giving appalling company star clearly reasons ,0,4,1,1,3,1,0,5,2,9,3.75,Positive,04-Apr-18,Wednesday,Apr-18,,,,,,,,,,,,,,,,,,,
421, never leave reviews occasion worst service ever experienced life problems setting account chat service phone lines log working received sim used personal hotspot stopped google d seems virgins response apple problem even though lots customers experience problem managed fix following steps online however let hotspot playstation hot spotted ipad internet stopped phone never encountered problem ee realise never left steps cancel letter struggled right department phone lines working online chat refused help even though lines days finally managed someone said cancel make sure fees charged within cooling period couple weeks later received two debits account phone far long spoke one advisor explained situation said sort put cancellations two accounts set set set one guy cancelled unauthorised account said  t process refund  ll need call back different department baring mind  ve phone minutes still now also told set online refund might processed repeat aynd ever set one account cancelled within cooling period wth going never experienced many problems company entire life requested speak manager guy extremely reluctant hold mins came back said manager call mins said hold don t believe anyone call back absolute joke never go ,1,3,1,3,1,4,2,7,7,7,-1.75,Negative,03-Apr-18,Tuesday,Apr-18,,,,,,,,,,,,,,,,,,,
422, tried contract plan new phone almost approved required verification next day receive phone call customer service tried sell plan sim months credibility increases don t need credibility decent credit score never late payment don t intend give monthly payment phone sim done credit check nothing recommended ,0,2,0,0,1,1,1,5,2,7,4.85,Positive,30-Mar-18,Friday,Mar-18,,,,,,,,,,,,,,,,,,,
423, total rip charging data whilst connected wifi check bill asap customer sevices dont care want money hope reading richard maybe busy counting money stole us tax free paradise island ,1,2,0,0,2,1,2,2,1,4,1.9,Positive,29-Mar-18,Thursday,Mar-18,,,,,,,,,,,,,,,,,,,
424, mobile years now changing sims lost ability receive texts two weeks now hours phone sign end problem ,0,1,0,1,0,2,0,1,2,2,-0.6,Negative,29-Mar-18,Thursday,Mar-18,,,,,,,,,,,,,,,,,,,
425, waste time spend hours nowhere ask supervisor never one available wait call back wait wait wait worst company ever ,0,2,1,0,0,0,0,0,2,0,-0.7,Negative,27-Mar-18,Tuesday,Mar-18,,,,,,,,,,,,,,,,,,,
426, fault great deal delivered within hours evening order ,0,1,0,0,1,1,1,1,1,1,0.25,Positive,27-Mar-18,Tuesday,Mar-18,,,,,,,,,,,,,,,,,,,
427, moved house london kent signal house mobile reason wifi calling hell phoned customer service said pay £ leave even though reception house surrounding areanever going back oavoid mobile ,1,2,1,1,1,2,1,2,2,4,-0.15,Negative,27-Mar-18,Tuesday,Mar-18,,,,,,,,,,,,,,,,,,,
428, took sim deal black friday deal fantastic issues mobile connection billing everything terms basic phone deal works well however part deal getting access wifi hotspots working thought quick call customer services resolve issue customer services seem care rather line fobbing st told number port fully gone systems call back weeknd app faulty wait upgradenew app still working register whenever connects media wifi hotspot asks password given customer services moving back ee contract period ,0,4,0,0,1,1,1,3,3,5,3.9,Positive,26-Mar-18,Monday,Mar-18,,,,,,,,,,,,,,,,,,,
429, loyal customer mobile couple years month issues basic £ monthly paygo plan minutes texts gb data bizarre set charges show recent bill calls made calling card call frequently usa familiar calling charges regularly used tesco calling card ensure bill affected never charged international rates using card last month suddenly flagged almost £ excess charges bill spite fact made calls local calling card number number bizarre showed bill immediately following dialed number asked come international calls used card charged card naturally called th march told see bill yet call back week cut twice called back week told call back computer working detail show call st sure resolved bill issued called told call back st still see data even though see web view since th march st went call lo behold suspended service bill limit even call customer service number phone took two days find someone let use phone suffer inconvenience hour long call worst part issue happened next lengthy debate rep phone th time explaining charged international calls placed calling card dialed directly number told called first told recognise calling cards charge access service fees understand charge number minutes call international call rate minutes charged minutes month offered information asked speak supervisor stated since call ask permission use calling card paid pocket avoid charges told read terms conditions know reads ten pages terms conditions asked one well response looking asked speak manager initially refused put provided name brusque woman basically told going satisfaction policy charge going consider solution meant giving credit charges reminded read terms conditions told never charged son friends use calling cards told lucky caught basically liar find evidence offered £ customer service credit fact called several times told wrong information said accept wanted charges issue escalated next level told £ perk withdrawn still going escalate issue pay money shut asked said following policy always answer following policy said keep bribe escalate anyway told suspension removed unless paid bill patience wore thin now way finding new carrier lousy customer service company poorly trains staff lead incorrect terrifically inconvenient suspension phone something digital system clearly tracked placed call calling card number noted used password first documented international number placed billed separately find little chilling given making local call london prefix somehow listening check digital access given supervisor share name talks condescendingly admitting read terms conditions either tells basically buy £ perk long drop issue told way escalation addressed via lengthy several days internal paperwork shuffling manager basically take opinion issue appalled mobilemedia way handled also still waiting call back broadband started waiting hear back monthly credit account going set larger phone package new phone tells company used blown virginmedia iphone mobile app virginmobile phone service network phones badservice customerservice refund customer uswitch reviews yelp comparephones tesco ,5,11,3,4,5,2,7,16,17,22,-1.4,Negative,25-Mar-18,Sunday,Mar-18,,,,,,,,,,,,,,,,,,,
430, completely useless nonexistent ,0,0,0,0,0,0,0,0,1,1,-0.95,Negative,24-Mar-18,Saturday,Mar-18,,,,,,,,,,,,,,,,,,,
431, reading reviews subscriberwith years add terrible customer service knowledge layman problems impression called specialists richard branson space trip mars unlimited vip tarrif service unlimited sent spanking new sim card nothing worked except everything unlimited nothing subscription bills paid full time trying pac number horror best offer vip customer mglad ,3,1,2,2,0,2,2,1,2,8,1.1,Positive,24-Mar-18,Saturday,Mar-18,,,,,,,,,,,,,,,,,,,
432, keep setting accounts disabled brother without permission  t close cause  s unable communicate properly ,0,0,0,1,0,2,0,3,2,3,1.55,Positive,24-Mar-18,Saturday,Mar-18,,,,,,,,,,,,,,,,,,,
433, wish stayed vodafone awful customer service saying used minutes mins month vodafone went now cant make calls cant anything bill ready dont take phone contract regret ,1,2,1,1,0,2,0,2,3,2,0.5,Positive,23-Mar-18,Friday,Mar-18,,,,,,,,,,,,,,,,,,,
434, shocking service absolutely disgusting cut phone bill due wont reinstate csa woman exremely unhelpful refusing let speak someone else putting hold long periods without even informing ,1,2,1,1,0,0,0,0,1,1,-3.4,Negative,23-Mar-18,Friday,Mar-18,,,,,,,,,,,,,,,,,,,
435, cancelled account within day cooling period first bill still taken direct debit call wait ages refund received another bill smaller amount time direct debit cancelled bill requested make manual payment call payment removed clearly problem billing accounts closed payments processed still put ever wanting try mobile future ,0,3,0,1,0,2,0,4,4,2,0.4,Positive,23-Mar-18,Friday,Mar-18,,,,,,,,,,,,,,,,,,,
436, since change sim mobile cant make calls properly mobile phone calls keep dropping connects call quality poor distorted called cust serv port numb rid contract twice given wrong port number beg give port number rid pathetic service paid cancellation contract even never buy anything ,0,2,2,1,0,2,0,2,6,1,-2.85,Negative,22-Mar-18,Thursday,Mar-18,,,,,,,,,,,,,,,,,,,
437, sure many bad reviews site experience leaving ee nearly years transition seamless messed phone settings use data one phone call later resolved asked ee number transferred done without glitch next day paying less half ee five times data really got cause complaint going holiday portugal weeks update experience return ,2,1,1,1,1,1,0,1,2,2,-0.1,Negative,20-Mar-18,Tuesday,Mar-18,,,,,,,,,,,,,,,,,,,
438, oh wish stars phone network locked years pay bill phone use phone decide leave horribly messed bill bore telling wanted deadlock letter go cisas regarding bill asked network unlock code use phone new networkrunaround time according geniuses handset registered send unlock code point readers idiotic gets even dumber advised take phone back shop bought asda ask unlock trying explain robots customer service stupid idea told requested days ago unlock code told submit form unlock code hearing nothing surprise surprise rang today told form submitted aarrggh ask told thing needed take back asda contact manufacturer phone unlock laughed said think second alcatel phone manufacturer unlock network hardware providers moral story never matter enticing give business buy phones never problems resolved richard branson give f companys customer service ,2,5,1,2,2,1,2,5,7,8,-1.3,Negative,19-Mar-18,Monday,Mar-18,,,,,,,,,,,,,,,,,,,
439, ordered new phone contract phone delivered days yet direct debit set letter confirming arrived next day called query told phone back never called told phone next week told phone days give answer receive phone cancelled order submitting written complaint well recommend company way reliable ,1,1,0,0,0,0,0,2,1,2,1.05,Positive,19-Mar-18,Monday,Mar-18,,,,,,,,,,,,,,,,,,,
440, phones one broke minor error sent fixed said screen broke pay £ fix eveb though months old warranty refused sent phone back screws missing damage describe someone tried open hammer bd phone broke exact way o took phone shop sort reboot fixed £ livid phoned comppain state sent back poor customer service laughed also dont complaints department every person spoke found amusing happened refused help cancelled tv deal thing months later cancelled phone contracts kept taking money told never cancelled give notice bill kept taking money without consent account hate snivelling money grabbing owner richard branson passion everyone better going company atleast customer service company complaints department obviously going poor customer service nothing criminals ,4,4,3,3,6,6,2,9,8,9,-3.15,Negative,18-Mar-18,Sunday,Mar-18,,,,,,,,,,,,,,,,,,,
441, stay away liars thieves unbelievable arrogance customer service cancelled sim card month contract within cancellation period despite assurances advisors separate occasions charged anything ignore email bill sure enough account debited £ see numerous review unusual called complain assured manager definitely ring back happen im still awaiting refund lied occasions top making unauthorised debit £ evidently take matter complaint seriously yet refund contacting ofcom shortly taking small claims court money repaid absoutely shocking customer service now trust cancelling media contract ,4,5,0,1,1,1,1,6,6,5,-4.8,Negative,17-Mar-18,Saturday,Mar-18,,,,,,,,,,,,,,,,,,,
442, hate mobile passion absolute joke company ring like talking brick wall understand trying say try make payment interested never tv internet phone even free favourif want stress free bother worth stress ,1,2,2,1,1,2,0,2,5,5,1.15,Positive,16-Mar-18,Friday,Mar-18,,,,,,,,,,,,,,,,,,,
443, incapable resolving smallest issues ,0,0,0,0,0,0,0,0,0,0,-0.15,Negative,16-Mar-18,Friday,Mar-18,,,,,,,,,,,,,,,,,,,
444, made huge mistake going offer gb data £ looked like great offer weeks realized scam using around gb data internet stops working toggle mobile data button times phone like literally every minutes make work happening months now using giffgaff problems whatsoever stay away viring mobile ,0,1,0,0,0,1,0,1,1,3,-0.15,Negative,16-Mar-18,Friday,Mar-18,,,,,,,,,,,,,,,,,,,
445, awful customer service years loyal mobile customer feel recent years customer service gone hill yesterday cancelled contracts daughter husband basically said ok bye try keep custom daughters contract gone tesco mobile asked pay contract go onto sim deal mins later different people still wanted rd person gave hung call back time patience buy husbands go another network rather pay good customer service ,1,8,1,2,5,1,3,5,1,7,1.45,Positive,14-Mar-18,Wednesday,Mar-18,,,,,,,,,,,,,,,,,,,
446, unhelpful phone stopped working midcontract insurance tried say insurance matter even though lost damaged phone reluctantly contacted insurance asked send phone give temporary replacement struggled year contract faulty phone end reluctant give pac code go another company avoid ,0,0,0,2,0,1,0,1,4,2,-4.5,Negative,13-Mar-18,Tuesday,Mar-18,,,,,,,,,,,,,,,,,,,
447, customer service tell one thing another always cost money never use ,1,1,0,0,1,0,1,1,0,2,0.6,Positive,13-Mar-18,Tuesday,Mar-18,,,,,,,,,,,,,,,,,,,
448, avoid like plague recieved threefigure charge international calls despite communicating contract negotiation international calls included contract unable rectify issue suggesting taking matter trading standards hung someone supposed manager horrific experience use ,1,1,2,3,0,3,0,2,5,3,-0.75,Negative,12-Mar-18,Monday,Mar-18,,,,,,,,,,,,,,,,,,,
449, terrible give stars know service patchy rural area live account nil connectivity getting large towns cities data mobile signal service worse useless people assume text mobile number yet take days text arrive home one sent even signal flipping train yesterday people round phoning using mobile data trying wifi trains whole story also charged times monthly bill recently trying claim must used data put complaint heard nothing rang month complaint even logged woman spoke said see evidence used data finally refunded toast contract ends ,2,3,2,2,2,2,1,3,5,3,-1.4,Negative,12-Mar-18,Monday,Mar-18,,,,,,,,,,,,,,,,,,,
450, jan lured £ sim deal first mistake changed mind within days charge meant incurred first cancellation process straight forward deliberately drawn staff member kept phone minutes took security admit cancel line gave another number call called number dealt really inept worker left doubt actually requested much called back minutes later confirm line cancelled fast forward march since £ taken account unlawfully dealt word mouth zero success requested email acknowledge refund details taken system supposed manager tell done showed ridiculousness least taking details system retracted said refund believe level unprofessionalism marketing great company good staff come contact less average care good deal never contract now makes sense deal good people must leaving droves ,1,3,1,1,3,3,3,8,4,10,2.25,Positive,12-Mar-18,Monday,Mar-18,,,,,,,,,,,,,,,,,,,
451, guys nothing mupets lesson thing say fup direct debit check blame eyes go else wear asking hull lot crap way look around ,1,1,2,0,0,0,0,3,3,2,-0.7,Negative,11-Mar-18,Sunday,Mar-18,,,,,,,,,,,,,,,,,,,
452, know people talking customer service excellent times called beginning month transferring orange number something else remember need contact since best customer service company least english £ contract since april may problems whatsoever also free twitter browsing without losing data nice bonus ,1,1,0,0,2,1,1,1,1,4,2.15,Positive,10-Mar-18,Saturday,Mar-18,,,,,,,,,,,,,,,,,,,
453, worst customer service ever experienced shore call centre staff  s english poor complaints go unheard contact changed error abvised  t change back now charged extra month less data customer service absolute joke honestly take advise stay well clear  s worth hassle long run ,0,1,0,1,0,1,0,2,2,7,0.5,Positive,10-Mar-18,Saturday,Mar-18,,,,,,,,,,,,,,,,,,,
454, pay go mobile one problem another customer service rude never say signed blackpool store back july given sim card apparently recycled payg phone called sort said send new sim card working days never arrived called another sent first class first bill charged double sim using one recycled sim name never heard finally sorted month months calling half time asked supervisor say call back issue finally went january point told hear back within working days hear anything mid february calling multiple times ask updates second issue finally resolved sim card stopped working phone another mins troubleshooted told receive new sim card working days post never arrived told must gone old address send new one first classnever arrived called morning find told notes interaction earlier week asked leave contract consecutive months fulfilled side contract adamant pay remaining months contract told report ofcom dared whole customer service system broken one accepts responsibility one say ultimately one cares ,1,6,1,2,2,3,2,4,3,7,2.3,Positive,10-Mar-18,Saturday,Mar-18,,,,,,,,,,,,,,,,,,,
455, sent new sim card told put straight away done locked phone rendering unusable despite fact bought phone completely unlocked use network phoned told foreign call center person unlocked phone ee network wait minutes minutes later phone tell wait hour phone hours later tell wait hours phone hours later person spoke asked imei number told said phone back minutes call back phone later night tell cancel contract however told unlock phone phone amazon got phone tell idiot phone amazon unlock phones insists call call amazon basically laughed told phone back tell phoned amazon said unlock phones tell phone ee phone ee laugh tell unlock phone tell ee said tell phone phone manufacturer lg phone lg tell unlock phone phone back tell lg said tell help point lose temper hang worst experience life now left £ phone use locked never ever consider using even offered services free managers available speak nobody british speak bunch monkeys reading script disgraceful company owned disgraceful tax avoiding antibritish shyster wish even give star ,2,3,3,2,2,3,2,4,8,8,1.25,Positive,10-Mar-18,Saturday,Mar-18,,,,,,,,,,,,,,,,,,,
456, awful like man behind brand got fed poor reception constant e band mobile internet access phoned cancel pac code receive hardsell treatment stay eventually got code told billed month halfs worth service even thought cancellation period supposedly days glad leaving shysters ,1,3,1,1,1,2,0,1,2,3,-0.25,Negative,10-Mar-18,Saturday,Mar-18,,,,,,,,,,,,,,,,,,,
457, dreadful customer service new sim card sent phone locked unable sense call centre every time told different story without network days now nothing unlock ,1,3,1,1,0,2,0,1,2,3,-0.05,Negative,08-Mar-18,Thursday,Mar-18,,,,,,,,,,,,,,,,,,,
458, dreadful customer service charged going data £ mb use plan gb data £ called prepared anything hands guess yes go charged fees daylight robbery contract expires june leaving ,2,3,2,2,0,2,1,1,2,2,-0.45,Negative,08-Mar-18,Thursday,Mar-18,,,,,,,,,,,,,,,,,,,
