Sr.no.,Review_body,anger,anticipation,disgust,fear,joy,sadness,surprise,trust,negative,positive,sent.val1,category_senti1,Date,Weekday,Month and Year,May-17,Jun-17,Jul-17,Aug-17,Sep-17,Oct-17,Nov-17,Dec-17,Jan-18,Feb-18,Mar-18,Apr-18,May-18,Jun-18,Jul-18,Aug-18,Sep-18,Oct-18,Nov-18
649, give minus stars sure others clearing outstanding balance told may wait hrs max reconnection someone uses phone work navigation purposes explained urgent able use data services promised another support agent line qould reconnected within minutes thought fine day age shouldnt take long hrs later still sitting waiting habing top pay go line customer service agents appauling incompitent stay well clear company terminating contract next month ,0,6,0,1,2,0,1,2,3,5,3.05,Positive,21-Oct-17,Saturday,Oct-17,,,,,,,,,,,,,,,,,,,
650, absolutley disgusting service customer service non existent hung laughed lied requests manager call eventually got call back posted social media request remove post use services safe money use decent company care customers ,3,1,1,2,2,1,1,2,2,4,1.9,Positive,19-Oct-17,Thursday,Oct-17,,,,,,,,,,,,,,,,,,,
651, ordered note shop taken details done credit check told phone stock shop women shop said likely online ordered online credit check taken bank details received email telling order parked someone contact us within hours rude guy even tell name called days later started asking odd unnessessary security questions nothing wanted know wifes dob name even though one ordering phone security check tells note stock believe ears ridiculous take peoples details tell actually phones neither mentioned website whether phones stock week later wife called order note phone taken details done credit check told go local shop show two proofs address although already customer years now guys shop said process anything details system usual practice told ordered online usually asked fax id directly whole fiasco seems dodgy called complain several times keep putting departments registering complain worst network provider ever deal ,2,2,1,0,1,1,1,7,3,8,-0.65,Negative,19-Oct-17,Thursday,Oct-17,,,,,,,,,,,,,,,,,,,
652, turns £month sim card mobile eldest son cost £ last months kids credit limit £ go allowance asking customer service remove feature teenager lowered £ seriously look competitors since found allow look customers lose ,2,1,1,2,1,2,1,3,2,5,0.9,Positive,19-Oct-17,Thursday,Oct-17,,,,,,,,,,,,,,,,,,,
653, ordered ph th oct now th still delivery ringing mobile useless twitter feed better recommend taking mobile contract case things go wrong legwork answers never mind resolution ,0,2,0,1,0,1,0,2,3,3,0.8,Positive,17-Oct-17,Tuesday,Oct-17,,,,,,,,,,,,,,,,,,,
654, total waste money bought pay monthly sim contractphoned customer services cap bill told minimum cap £ sim £ monthavoid rubbers ,1,3,1,0,2,0,1,3,2,3,-0.25,Negative,17-Oct-17,Tuesday,Oct-17,,,,,,,,,,,,,,,,,,,
655, sould stars absolute joke company signed online got email confirmation contract asked call verify details heard nothing called find going told cancelled called sorted got passed different people keep repeating calling gave hour phonere signed o took call minutes ,0,0,0,0,0,0,0,1,1,1,0.15,Positive,17-Oct-17,Tuesday,Oct-17,,,,,,,,,,,,,,,,,,,
656, absolute joke company promised free gear vr incentive sign year contract find open offer samsung s purchase multiple calls customer relations getting pushed one department another resolution cancelling never going use loyal decade ,0,1,0,1,1,0,1,3,2,6,2.3,Positive,14-Oct-17,Saturday,Oct-17,,,,,,,,,,,,,,,,,,,
657, recently divorced wife kept mobile name going favour paid bill ex decided change phones cancel direct debit without informing months unpaid bills later demand email collections company £ paying bill called mobile cancel contract unbeknown prove one hardest soul destroying experiences long time causing almost break tears times speaking overseas agents phone taking security incomparable nightmare daughters phone security details wifes yet every time called tell security details wrong take continuous cycle security questions password resets every time reset password today weeks continuous calls try cancel contract transpire keep mispelling even relayed back phonetically finally cancelled contract today informed bills generated much bad experience want add become ramble worst thing experience now default credit score wait irony actually work brand ,4,7,3,5,2,5,3,4,10,5,-5.6,Negative,14-Oct-17,Saturday,Oct-17,,,,,,,,,,,,,,,,,,,
658, bought mobil custom phone thru walmart years ago ported old number everything fine oct st nd turned service every receipt every month sept pay advice sept receipt dated supposed good till oct th automatically renew well oct st nd phone stopped working thought glitch waited day still working tried log account said account exits know sure exist called mobile said discontinued service said well paid month turn someones phone wo notification said sent notifications receive every receipt email every payment made payment receipts sent notification email also checked phone msg email notices angry liked plan much found another company similar service want move phone number require pin password prev provider called back said info gone purged system told days since turned phone way deleted info days now phone week phone nearly useless anything wo service paid thru oct th refuse give pin password move new provider horrible company already filed complaint fcc knows long take really need keep phone number according us gov right number cc rules title cfr parts fcc rules called asked talk legal dept said one customers talk ,3,7,2,1,3,0,1,9,6,8,0.35,Positive,11-Oct-17,Wednesday,Oct-17,,,,,,,,,,,,,,,,,,,
659, atrocious company deal mobile years got new experia aqua last year developed fault sent deemed irreparable replaced second hand experia aqua wich also developed fault returning three times spell three months tell damaged charging port unless pay £ even look fault see repaired please deal people ,1,3,1,1,2,2,1,3,3,3,0.35,Positive,11-Oct-17,Wednesday,Oct-17,,,,,,,,,,,,,,,,,,,
660, bad service poor customer service turn phone people besides stay minutes wait started july salford shooping worker gave wrong information called abroad charged £ called pardoned error months returned charge always services cut without saying hour first call disconnected recommend anyone lycamobile much better ,1,1,1,1,0,3,0,1,5,3,-1.5,Negative,10-Oct-17,Tuesday,Oct-17,,,,,,,,,,,,,,,,,,,
661, customer service pretty much useless fine basic enquiries selling phones upgrades comes anything different staff ability many years ordered iphone yodel lost got stolen company phone unable resolve date weeks later customer service dept various departments go security time incredibly frustrating sorted now ,1,2,0,0,1,2,0,2,4,4,0.25,Positive,09-Oct-17,Monday,Oct-17,,,,,,,,,,,,,,,,,,,
662, mobile worse company ever urge personally every single person uk avoid company call centre based outside advisor lied pretending help spend nearly hours today phone weren t helpful keep saying need speak different departments asked speak manager took manager told busy now call u min waiting hours calls therefore advise every person avoid virgins mobile thanks ,1,2,0,2,1,1,0,4,4,3,0.55,Positive,05-Oct-17,Thursday,Oct-17,,,,,,,,,,,,,,,,,,,
663, moved ee first bill times quoted exceeded gb internet allowance gb phone shows used gb never problem allowance ee mistake move ,0,0,0,1,0,2,0,1,2,1,-0.7,Negative,03-Oct-17,Tuesday,Oct-17,,,,,,,,,,,,,,,,,,,
664, avoid avoid avoid read reviews tell need know foreign call centre hard understand understand scouse accent ring back hrs twice promised one ever appalling customer service ditched two sim cards cut credit card favour go anywhere near keep blood pressure normal ,0,0,1,2,0,0,0,2,4,3,-1.2,Negative,03-Oct-17,Tuesday,Oct-17,,,,,,,,,,,,,,,,,,,
665, rubbish mobile company waiting days still activated despite given different sim cardsappalled ,0,1,1,0,0,0,0,0,1,0,-0.75,Negative,03-Oct-17,Tuesday,Oct-17,,,,,,,,,,,,,,,,,,,
666, abject performance mobile abroad times year network eu including gibraltar part uk mobile promised call back hours didn t wasn t prepared take poor bangladeshi staff customer service using full force law contact mobile regulator national media highlight breach contract phone service customer service incident th excursion abroad causing much distress utterly unfit tender stripped mobile licence ,3,4,3,3,1,2,2,4,5,7,-1.35,Negative,02-Oct-17,Monday,Oct-17,,,,,,,,,,,,,,,,,,,
667, used good contract years sudden g became patchy never signal swapped excellent three shame excellent deals ,0,1,1,1,2,1,2,2,1,2,1,Positive,01-Oct-17,Sunday,Oct-17,,,,,,,,,,,,,,,,,,,
668, awful customer service called cancel order phone contract told systems upgraded unable cancel phone following day rang minutes later able cancel order therefore lady spoke first lied systems running told easier wait phone arrive cancel made sense time consuming send phone back make another phone call etc experience happy decided cancel order nightmare line oh talk like robots strongly recommend go phone contract ,1,4,1,2,1,3,0,3,6,7,1.25,Positive,01-Oct-17,Sunday,Oct-17,,,,,,,,,,,,,,,,,,,
669, customer service joke tried call scripted answer like talking robot mobile please feel free contact keep asking otherwise please send court summons cant wait answers cant hide ,1,3,0,2,0,0,0,1,3,3,2.9,Positive,29-Sep-17,Friday,Sep-17,,,,,,,,,,,,,,,,,,,
670, option stars absolutely diabolical service phone sim since nd august woke last friday morning nd september signal usual switch remove sim etc ring customer services checks told need new sim receive within hours friday jump tuesday finally receive new sim work wrongly assume needs activating rang cc operative informed done needed switch phone back minutes work patiently waited another hour case rang back told activated now told take hour wait work waited bit longer rang told wrong postcode wth mobile expected believe end said wait overnight take hoursanyway left til next day rang back told technical issue techies fixing activated still pending really helpful like robots spoken advised ring next morning take hours deja vu also asked put complaint system point morning rang told another operative still hours wait manager call pm landline supplied home call lost patience rang cancellation line told cancel due rental agreement doubt true said send another sim card arrive days declined asked speak manager busy said manager call back within hour hat well hours ago time phone rang survey asking happy call say point wow seeking legal advise must add calls impolite despite operatives sounding robotic clearly scripted never straying script wish read reviews signing month ago badlatest update found shop miles away went explained whats happening rang customer care behalf whole hour phone came sayingomg see mean even tried fob went tell issue solved first call done job properly now escalated ee wednesday morning received email stating wait another days nothing done since ticket raised wednesday now without mobile phone weeks spent hours trying sorted seriously never use mobile havent even bothered respond review without doubt worst cc ever ,4,9,3,5,5,6,1,14,13,17,6.35,Positive,28-Sep-17,Thursday,Sep-17,,,,,,,,,,,,,,,,,,,
671, never use bunch racist scumbags hear accent refuse help eat lunch front ignore complaints monthsmike parramatta want rot nearest hole people like never born really hope read wish ignorant stuff help threw sorry thanks feedback meet jesus asap ,0,1,2,1,1,1,1,2,4,3,-2.1,Negative,28-Sep-17,Thursday,Sep-17,,,,,,,,,,,,,,,,,,,
672, new monthly sim son months ago bills money taken account unable logon online account says please try later phone customer service taken registration process says email already registered told media mobile account use email address pathetic put hold new adviser comes line go still unable access account ,1,2,1,0,1,2,1,4,2,4,2.15,Positive,25-Sep-17,Monday,Sep-17,,,,,,,,,,,,,,,,,,,
673, understand bad ratings always excellent service good prices sim free deals combined great signal ee network call centre sounds american competent never difficulties communication people always really friendly also twitter data free said leaving three simply feel home roaming service lets roam internationally noneu countries cancellation process super smooth pac given phone also texted instantly thanks years good service ,1,3,1,1,3,2,1,6,2,5,4.85,Positive,24-Sep-17,Sunday,Sep-17,,,,,,,,,,,,,,,,,,,
674, now say getting fed looking new provider prices gone reception got worse customer service appalling speaking accent make sense making fun pretending speak american accent people blatantly lie something simply call back asked million ridiculous security questions fake promisses render service month neglect pay yet receive courtesy years done service getting worse two years now seems stopped caring loyal customers case taking pounds elsewhere respected sad ,3,2,3,4,3,3,1,3,8,8,-1.55,Negative,23-Sep-17,Saturday,Sep-17,,,,,,,,,,,,,,,,,,,
675, uessless call centre staff really understand english asking near years tryed upgrade phone note online email telling contact next day staff told need take new number keep old one tell true passed staff members sorted cancel old order put new one place told phone sent thusday pre order saturday well satarday passed phone check tracking see sent via yodel alarm bells start ring yodel uessless phone picked yet monday call staff uessless telling liar never tell delivery date phone now th monday tracking now days phone local delivery depot inverness live miles away today satarday phone still sat inverness depot tell wait see comes yodel say delivered today still miles away tracking possible hour drive time going call later cancel everything move back ee staff used great used seas call centres every call takes time longer ,0,4,1,1,0,1,1,1,4,3,1.25,Positive,23-Sep-17,Saturday,Sep-17,,,,,,,,,,,,,,,,,,,
676,  ve vm years vip tariff however upgrade mobile phone last year s happy currant handset still payed full amount every month contract ended talking mates  ve realised amount paying including price handset got years ago even tho contract ran still charging line handset therefore called resolve issue see bring monthly bill £ since haven t upgraded hand set keep vip tariff includes unlimited data calls texts now bearing mind  m work lunch hour use phone quite bit browsing websites watching videos youtube facebook even watching tv series phone vm customer service adviser told don t need vip tariff see screen don t use gb data per month even gb much however safe side  ll getting gb data  ll never able go well guess one week sim tariff text message vm saying  ve used data called asking  ve done different data drain fast told gonna investigate back never time call say give gb extra month investigate matter nothing ever happens misled lied thinking don t use lot data give vip tariff longer offerbad business avoid means ,1,4,1,1,2,0,1,7,3,11,4.65,Positive,23-Sep-17,Saturday,Sep-17,,,,,,,,,,,,,,,,,,,
677, liars incredibly untrustworthy avoid got sold mobile contract phone got email confirmed including way less data called back immediately day cancel told send sim card guess send sim anyway call telling want account closed still within days cancellation say already closed fine email information contract call say already closed account one month later bill call say phone calls logged want cancel contract need pay fee trust company stuck plan illegitimately ,2,5,0,1,1,1,1,5,6,5,-0.15,Negative,16-Sep-17,Saturday,Sep-17,,,,,,,,,,,,,,,,,,,
678, terrible customer service listening saying trying explain things like child asked speak manager got laughed hung brilliant ,1,2,1,1,2,1,0,2,1,4,2.15,Positive,16-Sep-17,Saturday,Sep-17,,,,,,,,,,,,,,,,,,,
679, good deal number years due tv phone broadband came point media let new phone upgraded package expensive one finally signed pay £ month receive unlimited texts calls mb internet chose samsung s edge called monday th september gentleman said phone delivered wednesday signed online contract received email confirming phone indeed delivered wednesday th september wednesday phone arrived gave friday th september called check whereabouts phone man said yodel delivery company media decided use recorded delivered pm wednesday th september assured man delivered fact husband leaving house empty pm evening said personally call yodel following day phone lines now closed said call pm following day saturday th september expected call update happened call monday called media mobile first person said call yodel see happened put hold minutes voice said goodbye phone told person cleared called back another lady said called yodel asked put hold said saying phone delivered process now opened hour investigation assured someone call back home phone mobile longer working pm time home work said like someone call wednesday th pm inform result investigation said someone phone next day tuesday th september pm one evening th september called lady informed investigation complete told lady understandably upset solve problem hang phone like speak manager said manager tell point manager powers rest operators referring mansger said personally chase issue yodel call tomorrow explained two people promised call media happened happy outcome phone call evening put onto manager actually say asked new phone sent privately take issue yodel manager provided id number name said although sure needed make sure got phone explained number inconveniences caused phone including able call daughters school able call first day reiterated sure wasting time chasing got right still insisted investigation completed far without phone paying bill days even explain infuriating company passing person person promising call back promising personally follow things seemingly placating words absolutely nothingupdate got bill two months phone receive used cooling period cancel dreading phone call awful awful customer service team tomorrow ,3,13,3,4,5,5,3,14,8,18,5.75,Positive,13-Sep-17,Wednesday,Sep-17,,,,,,,,,,,,,,,,,,,
680, credit rating hoaxi created trust pilot account write review appalling found mobile graduated university july attained job centre london working finance industry done well evening felt quiet proud imagine felt told credit rating poor eligible phone contract still registered home address parents outstanding credit ratings thank god know enough able check credit score experian joke ring dad tell story informs interestingly enough credit provider use equifax news data breach protection millions customers quoted bbc article uks information commissioner ico said reports data breach potential involvement uk citizens gave cause concernwell thank causing young person trying succeed spend evening fretting possibly gone wrong tried touch avail live web chat allegedly busy despite open day repeatedly refreshing placed hold longer worth waiting find customer support email address seems want phone providers succeed fear currently live web chat vodafone staff member assures sim next three working days ,3,7,1,4,7,2,3,9,7,19,7.7,Positive,11-Sep-17,Monday,Sep-17,,,,,,,,,,,,,,,,,,,
681, give zero stars easily worst customer service ever seen utterly incompetent nearly hours line discuss phone bill screwed childrens account passed person person none agents passed information next admitted blind copied waited minutes useless transfer hung leaving immediately telling everyone know disgusting experience never ever use never use service utter shambles company ,3,1,1,1,0,1,0,2,7,4,-4.25,Negative,11-Sep-17,Monday,Sep-17,,,,,,,,,,,,,,,,,,,
682, phone developed problem make calls send texts checked line account said enough credits continue despite pay direct debit due taken account another days still well within minute data usage calls days customer service line spending £ hours time process lied regarding receiving call back told issue resolved full service restored within hours dealt incompetent uncaring staff little forward latest response process resolved maybe tonight maybe tomorrow enquired account suspended answer came back know well turned lie another hours later still reconnected contact mobile ending lied lying customers part customer agent training days phone calls mile round trip collect new sim card still resolution latest call ended agent stating shall raise tech department give us till tuesday tell much company values customers complete lack response complaints made really says ,4,7,3,1,2,4,2,5,7,8,-1.1,Negative,11-Sep-17,Monday,Sep-17,,,,,,,,,,,,,,,,,,,
683, bad service waited one week unblocked mobile still solveunacceptable sales service give zero star ,1,2,1,1,1,1,0,1,1,1,-0.15,Negative,09-Sep-17,Saturday,Sep-17,,,,,,,,,,,,,,,,,,,
684, well promised replacement faulty phone imos work sent three end confirmed go sim refund purchase paid now week renaged refuse let escalate complaint snotty staff cut see cancel dd cant wait court order ,3,2,0,1,0,1,0,1,6,1,-0.55,Negative,09-Sep-17,Saturday,Sep-17,,,,,,,,,,,,,,,,,,,
685, someone advise l final bill phoned rd august give days notice sim monthly tariff thirty days expired nd september soon l made call cancell l removed sim reverted pay go used text asking final bill emails returned automated systemvirgin seem ignoring cancellation emailed bill paid mid september surely final bill ,1,1,1,0,1,0,0,3,2,4,0.1,Positive,04-Sep-17,Monday,Sep-17,,,,,,,,,,,,,,,,,,,
686, stars customer years x sim d rolling contracts daughter increased monthly cost £without extra allowance included phoned ask match better deal seen elsewhere came data allowance original price said month contract though accepted contract sent post ot email appox wk text saying bill original price agreed list higher price tarrif signed online called complain agreed said correct took agreed amount bank another text wk later saying bill mine agreed called complain ask pac codes wanted leave due giving deal offered asked confirm early exit fee applied given pac codes told days use charged monthly tarrif long go allowance due workhols used pac codes days later tried sign online straight immediately cancelled online account got text saying exceeded limit account suspended nearly reached limit cancelled dd trust take bank emailed inform cancelled dd asking email itemised final billing £ sims gone earlt exit fee previously told make final payment trouble started received response hubby called store told owed nothing account either sim email last bill still days later now getting texts one todays said bill £ slycunning theives know amount gone beleive purposely ignoring sending contractual documentation rob blindscrew trying take money entitled going go store next day try resolve put end joy going contact obudsmann shocking customer service ashamed ,4,5,2,1,4,4,3,7,7,13,4.1,Positive,29-Aug-17,Tuesday,Aug-17,,,,,,,,,,,,,,,,,,,
687, give stars upgraded contract new deal still getting charged somet getting also took £ charges even tho wasent limit n phone cancel day rolling contract keep getting told carnt even tho iv year spent every day phoning theme last weeks time getting phone put fault see made mistake offer nothing resolve keep lying saying issuing refund phone back told nothing system go threw nothing chew stress n hastle recommend avoid ,1,2,1,1,1,3,1,3,7,3,-0.2,Negative,28-Aug-17,Monday,Aug-17,,,,,,,,,,,,,,,,,,,
688, give stars possible worst customer service ever asked cancel mobile contract within days told repeatedly asking cancelled checked days later called told email confirmation email confirmation total shocking service please stay away ,0,1,0,0,0,1,0,2,1,2,-1.4,Negative,27-Aug-17,Sunday,Aug-17,,,,,,,,,,,,,,,,,,,
689, useless customer service shocking advertise auto connect hotspots doesnt work new phone weeks later countless communications still work although got name someone else runs owns done years ,0,0,0,0,0,0,0,1,1,2,-0.05,Negative,24-Aug-17,Thursday,Aug-17,,,,,,,,,,,,,,,,,,,
690, new customer visa debit card refused never problem setting direct debit credit rating beyond excellent passed check advised call back card unblock never hear back instead call back set debit husbands card husband left talk talk mobile thought service bad vergin stated new sim arrive working days took well week arrive husband went three network sim arrive two days even scammed £ told spair sim card need top checked bank statement saw debited pounds actual pay monthly sim even arrived ridiculous pathetic customer service agent hang called five days find sim card guys sham make providers look great comparison ,4,6,4,3,2,5,0,7,7,9,-0.05,Negative,24-Aug-17,Thursday,Aug-17,,,,,,,,,,,,,,,,,,,
691, credit assessment ridiculous loyal customer years rolling sim already handset tried buy new phone prompted old phone longer working marketing letterstexts suggesting upgrade embarrassingly refused credit instore never defaulted payment life mention mear £ per month sim paying years credit rating excellent credit scoring company use equifax getting joy finding much freedom information act barely bothered give human response email another standard reply information sales pitch likely lose business husbands phone contract due renewal shortly cheap media package mistake revenue responsible lending policy leave automated decisions involve human ,3,1,2,3,4,5,4,8,8,11,1.75,Positive,22-Aug-17,Tuesday,Aug-17,,,,,,,,,,,,,,,,,,,
692, stay away mobile protect sent two replacement phones faulty returned first replacement believe returned want wait weeks investigation quite irrelevant send working phone poor customer experience mess definitely parting ways mobile protect ,0,3,1,0,0,1,0,1,4,4,-1.35,Negative,20-Aug-17,Sunday,Aug-17,,,,,,,,,,,,,,,,,,,
