Sr.no.,Review_body,anger,anticipation,disgust,fear,joy,sadness,surprise,trust,negative,positive,sent.val1,category_senti1,Date,Weekday,Month and Year,May-17,Jun-17,Jul-17,Aug-17,Sep-17,Oct-17,Nov-17,Dec-17,Jan-18,Feb-18,Mar-18,Apr-18,May-18,Jun-18,Jul-18,Aug-18,Sep-18,Oct-18,Nov-18
179, mega review worth reading considering switching going abroad recently went basel arrived received text saying use package uk normal however appreciate basel part france part switzerland received text inviting switch phone multi media messaging next day logged online surfed newspaper website racked £ worth data usage following day got text saying going switch account due reaching limit called found swiss charges raised complaint team told investigation opened someone call back days switched data immediately checked phone discovered text sent explaining charges switzerland seconds later multimedia message sent saw latter message days later got back basel airport received another text saying package per uk called check assured charged someone call back one called back today weeks later told notes back office say refund legitimate charges accidental guy laid back casual short rude excuse one bothered call back agree called retentions dept initially told refund full said refund £ £ said still thinking leaving refund anything told duty see messages telling texts large advertising message visible checked phone sent one fell deaf ears asked speak superviser told phone call back hour course one called back shambles years comparable deals loyalty counts nothing tried calling back refused refund want leave asked politely speak supervisor man refused saying nothing say want supervisor repeatedly asked speak superviser eventually agreed plunged phone silence call background whilst writing review phone call silent now minutes clearly hoping phone give staff reviewing website please advise scenario acceptable now ending call still held silence now minutes hang man suddenly comes back says £ credit applied account refund transpires discussion call called response text threatening close account switzerland actually charged £ man said free call queried hung got call number called back find asked chargeable call girl put hold hung called back time went billing man says switzerland europe absolutely charged normal package said wld check supervisor data usage refunded however holding phone comes back says sorry supervisor says tells £ credit pipeline £ worth charges phone says wait another month bill able told extra charges see end says phone call switzerland £ th july know calls charged outside package says charged £ call switzerland mistake calls around globe free back refund said charged event got home logged computer yes charged £ contact called back man said £ credit account yes charged call switzerland credit refund £ promised retentions said wait hrs see activity ombudsman may answer since believe anyone anymore one diff story another now phone hours calls made may credited £ plus £ may avoid customer care dont fufuaufufuaufufuub well call woman gave lecture incurred calls pay charges £ offer basically fault read text sent despite text tied advertising text see agreed accidental usage said refund pointed exactly last person said last telephone call earlier day called wind pm sunday night adding another minutes hrs earlier day sniggering phone offered cancel contract told thing decision clearly enjoying offers direct line cancel contract quickly paying people said basis last man phone told confirmed £ refund £ credited back charged call switzerland point call told escalate escalating good call give lecture incurred charges pay irrespective circumstances told phone wound now four hours life stolen customer care today stung charges call woman straw broke camels back researched find superdrug using offering unlimited calls unlimited texts gb data unused rollover £ pcm contract £ start gift vodafone offering similar deal £ pcm giff gaff similar deal bother wound overcharged abused fufuubfufuubfufuub update called told credits applied credit balance shown wiped now owe monthly amount oh dear even legal ,5,13,1,6,7,9,7,18,22,31,6.6,Positive,05-Aug-18,Sunday,Aug-18,,,,,,,,,,,,,,,,,,,
180, worst customer service offered  lifetime £ sim  told never change apart inflation months later said longer offer deal upped £ reduced minutes first rang email say changing told sent email accident wasn t changing months later direct debit went minutes went  m never aggressive operators questioned weren t going security questions operator hung didn t think change contract like obviously leaving ,1,1,0,4,1,1,2,1,3,3,-1.75,Negative,05-Aug-18,Sunday,Aug-18,,,,,,,,,,,,,,,,,,,
181, extremely rude unhelpful customer service forgot password tried resetting online unable due system accepting last name called customer service extremely rude lady unhelpful hung phone called second person asked email spelling letters person shouts says yes go outrageous service wonder one star reviews ,0,1,0,0,1,1,1,2,1,3,-0.8,Negative,04-Aug-18,Saturday,Aug-18,,,,,,,,,,,,,,,,,,,
182, terrible customer service cell phone service never representative phone unlock phone customer years stay away warned ,1,1,1,2,0,1,1,0,1,1,-1.25,Negative,04-Aug-18,Saturday,Aug-18,,,,,,,,,,,,,,,,,,,
183, shady pricing structure used main reason left canx tv landline perception customers providing value money reinforced constant price hikes inability pay fare fee creators content greedy give single £ necessary incidently price offered keep packageyet happy rip people long term stay away stream now tv firestick anything bunch money grabbing con men ,2,5,1,1,5,1,1,8,4,10,0.7,Positive,03-Aug-18,Friday,Aug-18,,,,,,,,,,,,,,,,,,,
184, beyond joke bought pay monthly sim contract teenage son birthday present put sim card phone receive calls texts credit back carphone warehouse twice now keep telling set payg swap within hrsstill nothing heads going roll tomorrow ,0,5,0,0,3,0,2,5,2,5,2.35,Positive,03-Aug-18,Friday,Aug-18,,,,,,,,,,,,,,,,,,,
185, drawn slightly lower prices end paying much short medium long term thought try mobile quickly realised poor phone signal around lived phoned cancel within days stood strong instead told fix issue new handset resolve agreed give go big mistake long meant still cancel part day customer satisfaction guarantee resolve issue promised weeks replacement phone different sim troubleshooting multiple times agreed fix issue send bag return handset bag never arrived got stuck loop talking literally worst customer service reps ever dealt email back office function find issue bag time chased bag told take business days response back office even escalating called managers process loop important things note mobile provide email address communicate now know must avoid everything writing customer service reps also double customer complaints department least told several occasions essentially escalate actually true told managers call back like say need put aside hours every time need call back finally got bag return phone months starting return process unfortunately damaged phone time phone insurance told now meant cancel even explaining phone repairable insurance fact damage phone respect customer satisfaction guarantee even admit provide phone signal live finally got someone threatening cancel direct debit quickly tried offer £ resolution handing another manager totally context resolve expensive issue trying resolve now realise knew heading trying resolve issue trying make look like ends third party ombudsmen complaint servicenext manager phone admitted customer complaints different department customer service lied multiple times upped offer £ resolution explained resolve issue trying resolve trying charge two year contract service knowingly provide manager said accept need file complaint cisas third party ombudsmen service asked writing days later resolution proposal writing offer changed £ £ agreed port number onto new provider cancel remainder contract minutestexts phone decided now time accept even though really justice situation wanted mobile life envelope written resolution totally different one offered verbally another sheet paper declaring reached deadlock oddly date stamped now needed go cisas make complaint rung mobile discuss obvious error written resolution declaration reaching deadlock sent envelope accept resolution written told different mobile managers long talk reached deadlock still believe currently going cisass complain procedure months paying phone use network provide phone signal town live hope someone mobile actually cares reads takes serious look operate worry processes designed scam people money rather provide service actually designed work way ,6,10,3,4,4,7,3,13,12,16,1.25,Positive,03-Aug-18,Friday,Aug-18,,,,,,,,,,,,,,,,,,,
186, really like leaving bad reviews experienced truly terrible customer service made easy leave mobile warned long review read discover considering leaving first found great deal via uswitch first hurdle getting past security checks first call asked pw ve set first joined two years ago said sure two years rung much operator said unless knew pw access account obviously case pressed surely confirm means asked security questions ended times calls got disconnected fair enough except one operators helped reset pw next call realised reset hang call account got locked start guy retention team told compare plans via third party like uswitch may offer mobile provider offers even implying practices may questionable never heard theory company made deal uswitch therefore anything offer company consents first sign routine offered lots incentives stay reasonably polite kept talking reiterating points even said got whenever asked question jumped gave longwinded answer confused even finally considered taking offer leave work asked continue conversation later day case rang provider check deal saw online told expired offer something almost good decided accept also even top costumer service superb won s now needed pac code proved final straw rang last time failed attempts train wanted code quickly new sim next day told lady wanted pac number asked wanted leave said plainly experienced appalling customer service unless match deal day contract stay offering months ridiculous considering fast new offers generated want take advantage new deal half way existing contract enter yet another months unless see old plan leave also said knew anything better based previous conversations apologise everyones behalf appreciated however stay upbeat kept trying find something taking longer happy point nice keeping waiting either saying something like moment trying find something said please forget finding deal pac code gave code proceeded tell leave dd open three months case incurred roaming charges said done aboard repeated keep dd instructions open may incur roaming charges said knew plus take three months billed understand another month three instead explaining things calmly said cancel chose pay final bill thinking trying avoid paying bill asked final bill point hung phone heard click definitely hung explanation never hung customer service rep work call centre discovered sacked believe thankfully conduct made much easier leave mobile perhaps good nothing outsourced call centres clearly training standards subpar best every single operator spoke hurry listen instead listening trying tell couple patronising tell child lack intelligibility solve problem need admit insinuate customers fault ve liked surprised bad reviews already trustpilot sadly confounded stats wish looked reviews signing first place staying long surely retain passive demographic never check much value money getting return allowances focus completely recruiting new customers know getting please focus revenue cutting costs increase margins outsource calls need make sure wherever people calling understand culture country dialing frankly accents gave away stranger still everyone seemed english name like andy acting foreign help case afraid really hope investigate things running good time restore reputation ,5,20,7,10,9,10,8,20,25,28,12.45,Positive,02-Aug-18,Thursday,Aug-18,,,,,,,,,,,,,,,,,,,
187, called multiple times asked complaint looked never frustrated locked contract getting service paying worse thing keep reading richard branson thinks companies superior ditched latest book disgust ,3,0,1,2,0,2,0,1,4,3,-2,Negative,02-Aug-18,Thursday,Aug-18,,,,,,,,,,,,,,,,,,,
188, utterly frustrated dealing called customer service spent minutes explaining access mobile account check monthly charges checking e mail addresses passwords discussing two operatives changes made e mail address access accounts new passwords put place told good golike hell good go left charge made bank account unable check range services including tv broad band works monthly payment substantial feel getting value money many years dealing time move others beware ,3,7,1,2,2,2,2,6,6,6,0.35,Positive,01-Aug-18,Wednesday,Aug-18,,,,,,,,,,,,,,,,,,,
189, paid full amount month first day received new sim card informed way finishing campaign end month unfortunately use various services single service mislead ripped customer service always misleads ,1,0,0,1,0,0,0,2,1,4,0.05,Positive,01-Aug-18,Wednesday,Aug-18,,,,,,,,,,,,,,,,,,,
190, rarely leave reviews customer service ay absolutely terrible leave zero stars customer support care circumstances laugh stress might tell relax even though company charging things ordered unless like spend mins hold transferred another department spend another minutes hold avoid companyavoid costs ,1,0,1,2,1,2,2,1,4,4,0.65,Positive,31-Jul-18,Tuesday,Jul-18,,,,,,,,,,,,,,,,,,,
191, purchased sim deal data mins texts £ pcm already media home broadbandlandline receive data sim card tried sim card different phonesreset apnsetting etc giffgafftalktalk normally put sim card voila works complained ceo made numerous attempts fixed customer services end got pac number leave believe atrocious service received occasion last phone call customer services unsatisfying rude media already aware problem exists choose ignore cause extreme upset customers saying permutation reasons fault tried possibilitiesstill joy stay clear company await response complaint compensation inferior service additional information provided pac code leave transfer complete fully sim card active number new provide three active number calls coming still routed sim problem required lot phone calls emails think now fully ported now ,3,4,1,1,2,5,2,6,9,8,-1.6,Negative,31-Jul-18,Tuesday,Jul-18,,,,,,,,,,,,,,,,,,,
192, chose sim deal total nightmare make receive callsspoke advisor able adequately explain service corrected insisted speaking supervisor manager advisor interested defending procedures said pass message knew previous experience calls rarely returned asserted right speak customer manager went mins resolution one anyone else hours terrible wish stayed current supplierhoping cancel pac transfer ,1,2,2,2,1,3,1,4,4,6,0.75,Positive,31-Jul-18,Tuesday,Jul-18,,,,,,,,,,,,,,,,,,,
193, denied contract phone first took sim deal told six months upgrade another contract months gone phoned phone told leave sim deal stuck another six months upgrade phone knowing phone broken broken hearted avoid told cancel sim deal dif pay remaining nonths ,1,2,0,2,2,4,2,2,5,3,-1.9,Negative,31-Jul-18,Tuesday,Jul-18,,,,,,,,,,,,,,,,,,,
194, husband offered upgrade couple weeks ago offer sounded great meant need new sim  s things went wrong sim didn t work samsung phone several calls many hours put hold advised factory reset took half hours regain previous apps information contacting re compensation said manager call leaving message direct number name call spending another minutes phone didn t resolve issue offering £ compensation must plus hours inconvenience completely happy contract staff rude don t seem care call days probably day  s working  t answer come sort many complaints need ,0,2,0,0,1,0,0,6,2,7,2.9,Positive,30-Jul-18,Monday,Jul-18,,,,,,,,,,,,,,,,,,,
195, recently change phones spent hours best buy time spent waiting customer service answer phone call even guys helped visibly annoyed least got paid afterwards found almost phones tried incompatible s service last one identical one worked came mobile box strongly recommend going different service ,1,2,1,1,1,1,0,3,2,5,2.4,Positive,30-Jul-18,Monday,Jul-18,,,,,,,,,,,,,,,,,,,
196, unknowledgeable called customer service agent stop talking hang shame used trust guys ,0,0,1,1,0,1,0,1,1,1,-0.9,Negative,29-Jul-18,Sunday,Jul-18,,,,,,,,,,,,,,,,,,,
197, leaving twenty years give damn good deal recently added £ per month notice letter opt change course know many people read properly act upon within one month decline window resent shabby barrow boy tactics tried several times call first time told seen better tariff another network introductory offer said rubbish said thinking leaving put hold forever put phone second time told increase line rpi inflation also rubbish said going put hold speak cancellation team gave direct number work third time said wanted stay new tariff locked month contract rather rolling one month told ts cs contract getting worse worse enough problem cancel effort keep custom years estimate spent ££ different information every time called including confusion password broadband thinking canceling well want give moneystay away ,4,5,6,6,2,3,2,5,13,8,-0.95,Negative,28-Jul-18,Saturday,Jul-18,,,,,,,,,,,,,,,,,,,
198, absolutely horrific customer years signal poor last years agreed never allowed run debt autism adhd avoidant pd pd possibly bipolar new contract  forgot  continue reasonable adjustments disability apps background ran background running debt harassed months seriously mentally ill daily calls demanding money told bankrupt debt charity says afford £ month particularly bad call said going kill sent police section police think needed sectioning evil rubbish use ,5,4,5,7,2,8,1,6,11,8,-4.15,Negative,27-Jul-18,Friday,Jul-18,,,,,,,,,,,,,,,,,,,
199, honestly  m much trouble mobile media don t know company well tricky damn marketing substance bill double reason called passed different people told system error take days refund ,1,1,1,0,0,1,0,3,2,4,0.35,Positive,27-Jul-18,Friday,Jul-18,,,,,,,,,,,,,,,,,,,
200, made mistake joining mobile uk realise taken look page woeful customer service reviews week trying someone give access account told call back time actually working daysupdated three weeks still waiting customer services deal query ring back despite huge number phonecalls absolutely dismal thinking taking contract definitely recommend use another company one running ground purpose ceo knows c service issues chooses act hope ceo reading review tommockridge virginmediacouksince writing review issues eventually resolved benefit following bt copying customer service model done uk locals actually care service give ,0,4,1,1,2,3,2,6,3,9,2.5,Positive,27-Jul-18,Friday,Jul-18,,,,,,,,,,,,,,,,,,,
201, bad bad service ,1,0,1,1,0,1,0,0,1,0,-0.75,Negative,27-Jul-18,Friday,Jul-18,,,,,,,,,,,,,,,,,,,
202, beware hidden clause upgrading phone monthly plan price may change time contract people pay extra go allowance change monthly plan price time seems bit scam ,0,4,0,2,1,0,0,1,2,2,-0.95,Negative,27-Jul-18,Friday,Jul-18,,,,,,,,,,,,,,,,,,,
203, used like mobile time struggling financially big way even gave couple months courtesy tried diligently fix network problems even waived fee ship replacement phone lcd unit became nonfunctional less month purchase happened years ago although never understood reason behind charge st place call centers based countries halfway around globe thick foreign accents notable unfamiliarity english language always presented communication barrier english speaking usa residents like granted little frustrating hugissue past several months things really slipped lg tempo lcd unit stopped functioning screen looked like kaleidoscope phone months customer service rep spoke told problem send new phone last second sneaked charge refueled waive spoke supervisor minutes arguing threatening drop wsp reluctantly agreed ensured correct shipping address d recently moved told phone arrive business days days later phone days later still phone called customer service find reason delay csr idea talking quickly put hold minutes long wait came back line inform order yet processed type phone longer stock long argument insisted speaking supervisor put hold minutes supervisor came arrogantly informed must pay fee pay fee phone defective start stock problem pay something part without use phone week another intense argument pointing aforementioned finally relented meantime choice go local walmart spend purchase new phone days later new phone finally arrived phone defective battery charged many hours spent phone hold arguing csr sent yet another phone yet phone configured activated calmed took battery phone activated placed phone defective battery finally functional wireless phone technically without wireless device weeks purchased phone walmart thrust extreme financial hardship wireless device crucial earning living ,8,11,5,4,4,3,3,9,15,13,-1.9,Negative,26-Jul-18,Thursday,Jul-18,,,,,,,,,,,,,,,,,,,
204, load crapp useless years lie cheat keep hold never go back suggest move provider best move customer listen ,2,0,2,0,0,1,0,1,3,1,-1.5,Negative,25-Jul-18,Wednesday,Jul-18,,,,,,,,,,,,,,,,,,,
205, mobile without doubt worst service ever experienced poor reception dropped connections since start also seem random £ charges added bill dozens calls still resolved customer service terrible operators hang honestly one star good wish give none ,1,5,1,2,2,2,1,6,3,5,1.6,Positive,25-Jul-18,Wednesday,Jul-18,,,,,,,,,,,,,,,,,,,
206, hidden charges explained agree price go plan even carry loads minutes data hit £ extra charges sending couple photos via text messenger ,1,1,0,0,0,0,0,1,2,2,0.4,Positive,24-Jul-18,Tuesday,Jul-18,,,,,,,,,,,,,,,,,,,
207, poor service round previously giffgaff never problems however enticed offering cheap deal however encountered problem problem mainly never signal make receive calls use data huge problem common one customers try ring possibility rectify issues impossible bunch useless automated options go speaking human finally someone based india minimal english hard speak offer little terms resolving problem catch please stay away mobile warned ,0,6,1,2,2,2,4,5,5,5,-1.25,Negative,24-Jul-18,Tuesday,Jul-18,,,,,,,,,,,,,,,,,,,
208, offering good mobile contract dealscheaper comparison competitors upfront cost iphone x £ however scam tried order handset three different cards decent balance frequent usage good credit score rejected  credit score checks  ordered online confirmation email delivery date however date passed received word new phone emailed informed  delay  call customer services enquire rang said one point away credit score required phone three times person tired absolute hardest sell sim contract happed friends also allure people good deals try convince buy expensive plan don t fall ,1,7,1,1,3,2,3,8,4,14,2.2,Positive,23-Jul-18,Monday,Jul-18,,,,,,,,,,,,,,,,,,,
209, despite negative reviews really pleasant experience mobile got competitive plan recently ran data started charged plan couple days came £ surcharge called ask waive know got waived charge without hassle ,1,3,0,0,1,1,1,2,2,2,0.4,Positive,23-Jul-18,Monday,Jul-18,,,,,,,,,,,,,,,,,,,
210, fall companies lies applied mobile months ago declined couple days later persistant calls te mobile sales team answered told sim deal looking talked telling monthly payments time via direct debit automatically eligable upgrade handset questioned asking upgrade told yes months pass bill paid time direct debit apply apparent gurenteed upgrade told turns fed load lies sales team trap sim contract anyone gets call declined handset offering sim upgrade months fall like ,0,4,0,0,1,1,1,5,2,2,-0.4,Negative,23-Jul-18,Monday,Jul-18,,,,,,,,,,,,,,,,,,,
211, though always applauded brand mobile service less one five experienced since joined oct phone connected without visiting local retail shop wrong sim card two lots overcharging two bills outstanding rude arrogant staff listen cut line ask speak managers long wait times speak insulted staff cancellations processed put pay go tariff ask customer login system work usage tracked connected different users line account paltry response complaints team ignores issues raised response language uses make conclude actually written member mobile well good one four members family left company see ,2,5,2,0,3,0,1,7,5,7,-0.8,Negative,21-Jul-18,Saturday,Jul-18,,,,,,,,,,,,,,,,,,,
212, really fathom everyone else negative mobile recently signed sim deal process went without hitch sim card arrived within couple days put phone worked perfectly straight away now month relationship mobile bad word say service works perfectly signal problems billing problems problems highly recommended listen doom mongers ,1,2,1,2,1,2,1,3,3,3,0,Neutral,20-Jul-18,Friday,Jul-18,,,,,,,,,,,,,,,,,,,
213, absolutely appalling service couple years media s loyalty discount found actually paying g service quoting new customers phoned explain issue ended extremely rude agent hung tried two hours got promise months credit switched new deal now found actually double charged instead now take double charge rather honour original promice credit month given live ,0,1,1,1,3,0,1,7,1,7,2.7,Positive,19-Jul-18,Thursday,Jul-18,,,,,,,,,,,,,,,,,,,
214, signal poor know never fix ithave requested pac today moving another supplier ,0,0,0,0,0,0,0,0,0,0,-0.5,Negative,19-Jul-18,Thursday,Jul-18,,,,,,,,,,,,,,,,,,,
